{
  "format": "wiretruth.scenario/v1",
  "id": "truncation.text-stream-usage",
  "title": "Streamed text cut off before a final usage chunk",
  "bug_class": "silent-truncation",
  "priority": "P0",
  "summary": "The model stops a streamed answer at the token limit and reports usage in a separate final chunk.",
  "call": {
    "stream": true,
    "max_output_tokens": 16,
    "messages": [
      {"role": "user", "content": "Describe a traditional Japanese breakfast in about 200 words, giving each dish its Japanese name (for example 味噌汁 or 焼き魚) and an English translation."}
    ],
    "reasoning": {"effort": "none"},
    "extra": {"include_usage": true}
  },
  "providers": ["openai-chat", "gemini"],
  "requirements": [
    {
      "id": "cause-is-truncation",
      "level": "MUST",
      "check": "truncation_is_signalled",
      "text": "The caller can tell that the output stopped at the token limit."
    },
    {
      "id": "text-reported",
      "level": "SHOULD",
      "check": "text_matches_truth",
      "text": "The text is reported exactly as the provider sent it."
    },
    {
      "id": "usage-reported",
      "level": "SHOULD",
      "check": "usage_matches_truth",
      "args": {"fields": ["input", "output"]},
      "text": "Token usage is reported and matches the provider's counts."
    }
  ],
  "grading_notes": "For Chat Completions, a usage-only chunk with choices: [] follows the finish chunk. Gemini needs no usage opt-in and may carry usageMetadata on several chunks, including the finish chunk; truth takes the last snapshot. The library must retain the truncation signal while reading usage. Gemini MINIMAL can still use tokens for thoughts."
}
