{
  "format": "wiretruth.scenario/v1",
  "id": "stream.utf8-split",
  "title": "Stream chunks split inside UTF-8 characters",
  "bug_class": "stream-integrity",
  "priority": "P0",
  "summary": "The same bytes as stream.utf8 are split into chunks whose boundaries fall inside multi-byte characters.",
  "call": {
    "stream": true,
    "max_output_tokens": 64,
    "messages": [
      {"role": "user", "content": "Reply exactly with: Café Zürich — καλημέρα! 東京で会いましょう 🌸🎉"}
    ],
    "reasoning": {"effort": "none"}
  },
  "providers": ["openai-chat", "openai-responses"],
  "requirements": [
    {
      "id": "text-reported",
      "level": "MUST",
      "check": "text_matches_truth",
      "text": "The streamed text is reported exactly as the provider sent it."
    },
    {
      "id": "no-replacement-chars",
      "level": "MUST",
      "check": "no_replacement_chars",
      "text": "The reported text contains no replacement characters."
    }
  ],
  "grading_notes": "The replay server pauses between chunks so clients see separate reads, though the operating system can still combine them. A correct client preserves the text regardless of where reads end. Decoding each chunk independently can introduce replacement characters. stream.utf8 is the unsplit control."
}
