{
  "format": "wiretruth.scenario/v1",
  "id": "usage.stream-final-chunk",
  "title": "Streamed usage in a final chunk with no choices",
  "bug_class": "usage-accounting",
  "priority": "P0",
  "summary": "The model finishes a short streamed answer, then reports usage in a chunk with no choices.",
  "call": {
    "stream": true,
    "max_output_tokens": 64,
    "messages": [
      {"role": "user", "content": "In one short sentence, explain why the sky looks blue."}
    ],
    "reasoning": {"effort": "none"},
    "extra": {"include_usage": true}
  },
  "providers": ["openai-chat", "ollama", "ollama-openai", "gemini"],
  "requirements": [
    {
      "id": "usage-reported",
      "level": "MUST",
      "check": "usage_matches_truth",
      "args": {"fields": ["input", "output"]},
      "text": "Token usage is reported and matches the provider's counts."
    }
  ],
  "grading_notes": "Chat Completions usage comes in a final chunk with choices: []. Native Ollama always puts usage on its done: true line; include_usage needs no wire option. A library that crashes on empty choices grades CRASH. A library that needs an opt-in to receive streamed usage is fine when the shim passes it the library's own way. Gemini usageMetadata needs no opt-in and may appear on multiple chunks; the final available snapshot is authoritative, even if it follows the finish."
}
