{
  "format": "wiretruth.scenario/v1",
  "id": "request.max-tokens-ollama-openai",
  "title": "Output limit reaches Ollama's OpenAI-compatible endpoint",
  "bug_class": "request-fidelity",
  "priority": "P1",
  "summary": "A short answer is requested through the OpenAI-compatible endpoint, which only honors the max_tokens field.",
  "call": {
    "stream": false,
    "max_output_tokens": 16,
    "messages": [
      {"role": "user", "content": "Name three moons of Jupiter."}
    ],
    "reasoning": {"effort": "none"}
  },
  "providers": ["ollama-openai"],
  "requirements": [
    {
      "id": "limit-field",
      "level": "MUST",
      "check": "request_field_equals",
      "args": {"path": "max_tokens", "value": 16},
      "text": "The request sends the output limit as max_tokens, the field Ollama applies."
    }
  ],
  "grading_notes": "Ollama v0.40.3 ignores max_completion_tokens on /v1/chat/completions: a request for 16 tokens ran to its natural end (about 1 KB, 65 s), while max_tokens stopped at 16 (docs: https://docs.ollama.com/api/openai-compatibility lists max_tokens only). The response is an ordinary recorded one; the requirement checks the request, so it is tied to Ollama v0.40.3: once Ollama accepts max_completion_tokens (ollama/ollama#7125) a library that sends it is fine in practice, but this cell still grades it WRONG. Retire or rewrite the scenario then.",
  "references": ["https://docs.ollama.com/api/openai-compatibility"]
}
