{
  "format": "wiretruth.scenario/v1",
  "id": "tools.parallel-calls",
  "title": "Parallel tool calls for two cities",
  "bug_class": "tool-call-fidelity",
  "priority": "P1",
  "summary": "The model returns one weather tool call for each of two cities.",
  "call": {
    "stream": false,
    "messages": [
      {"role": "user", "content": "What's the weather like right now in São Paulo and in Zürich? Call the tool once for each city."}
    ],
    "reasoning": {"effort": "none"},
    "tools": [
      {
        "name": "get_weather",
        "description": "Get the current weather for a city.",
        "parameters": {
          "type": "object",
          "properties": {"city": {"type": "string"}},
          "required": ["city"],
          "additionalProperties": false
        }
      }
    ],
    "tool_choice": "auto"
  },
  "call_overrides": {
    "ollama": {"tool_choice": null},
    "ollama-openai": {"tool_choice": null}
  },
  "providers": ["openai-chat", "openai-responses", "ollama", "ollama-openai", "gemini"],
  "requirements": [
    {
      "id": "calls-reported",
      "level": "MUST",
      "check": "tool_calls_match_truth",
      "text": "Both tool calls are reported with the ids, names and arguments the provider sent."
    }
  ],
  "grading_notes": "Both calls must be reported with their ids, names and parsed arguments in order. Ollama overrides omit tool_choice because neither endpoint supports it. Native tool calls arrive whole, and done_reason is stop even when calls are present. Gemini functionCall parts also arrive whole: STOP with any calls means tool_calls. Wire ids are optional; when absent, a library-generated id is accepted."
}
