{
  "format": "wiretruth.scenario/v1",
  "id": "truncation.reasoning-only",
  "title": "Reasoning exhausts the output limit before an answer",
  "bug_class": "silent-truncation",
  "priority": "P0",
  "summary": "The model spends the output token limit on reasoning and stops without sending answer text.",
  "call": {
    "stream": false,
    "max_output_tokens": 64,
    "messages": [
      {"role": "user", "content": "Find the smallest positive whole number that leaves a remainder of 1 when divided by 2, 3, 4, 5 or 6 and is divisible by 7. Check your answer before replying."}
    ],
    "reasoning": {"effort": "medium"}
  },
  "providers": ["openai-chat", "openai-responses", "ollama", "ollama-openai", "gemini", "anthropic"],
  "call_overrides": {"gemini": {"reasoning": {"effort": "high"}, "max_output_tokens": 32}},
  "requirements": [
    {
      "id": "cause-is-truncation",
      "level": "MUST",
      "check": "truncation_is_signalled",
      "text": "The caller can tell that the output stopped at the token limit."
    },
    {
      "id": "text-reported",
      "level": "MUST",
      "check": "text_matches_truth",
      "text": "The provider sent no answer text, so none may be reported."
    },
    {
      "id": "usage-reported",
      "level": "SHOULD",
      "check": "usage_matches_truth",
      "args": {"fields": ["output"]},
      "text": "Token usage is reported and matches the provider's counts."
    }
  ],
  "grading_notes": "The call aims to spend the output limit on reasoning. Gemini overrides effort to high and the shared thought/answer limit to 32 (as recorded, thoughts and answer share the limit). The recorded candidate is MAX_TOKENS with content {} and no parts, and usage has thoughtsTokenCount but no candidatesTokenCount. A candidate may lack content or parts, or carry only thoughtSignature. Assuming a text part exists and raising IndexError or KeyError grades CRASH. Null or empty answer text must be reported as none, and the caller must be told that the output stopped at the token limit. Output usage includes reasoning tokens. Anthropic expresses the neutral medium effort with adaptive thinking and output_config.effort; no override is needed. The assumed max_tokens response has one empty thinking block plus signature, no text, and output_tokens_details.thinking_tokens equal to the output count."
}
