{
  "format": "wiretruth.scenario/v1",
  "id": "truncation.tool-call-args-stream",
  "title": "Streamed tool-call arguments cut off by the output token limit",
  "bug_class": "tool-call-fidelity",
  "priority": "P0",
  "summary": "The model stops at the output token limit partway through the arguments of a tool call.",
  "call": {
    "stream": true,
    "max_output_tokens": 20,
    "messages": [
      {"role": "user", "content": "Create an event for a weekend pottery workshop in Málaga on 2026-11-14 with 30 attendees. Invent their full names, mixing Spanish, Greek and Japanese names written in their own scripts."}
    ],
    "reasoning": {"effort": "none"},
    "tools": [
      {
        "name": "create_event",
        "description": "Create a calendar event.",
        "parameters": {
          "type": "object",
          "properties": {
            "title": {"type": "string"},
            "date": {"type": "string", "description": "YYYY-MM-DD"},
            "city": {"type": "string"},
            "attendees": {"type": "array", "items": {"type": "string"}}
          },
          "required": ["title", "date", "city", "attendees"],
          "additionalProperties": false
        }
      }
    ],
    "tool_choice": "required"
  },
  "call_overrides": {
    "anthropic": {
      "tool_choice": "auto",
      "messages": [
        {
          "role": "user",
          "content": "Call create_event. Create an event for a weekend pottery workshop in Málaga on 2026-11-14 with 30 attendees. Invent their full names, mixing Spanish, Greek and Japanese names written in their own scripts."
        }
      ],
      "extra": {
        "anthropic": {
          "eager_input_streaming": true
        }
      }
    }
  },
  "providers": ["openai-chat", "openai-responses", "anthropic"],
  "requirements": [
    {
      "id": "no-complete-partial-call",
      "level": "MUST",
      "check": "no_complete_tool_call_from_partial_args",
      "text": "Partial tool-call arguments are never presented as a complete parsed call."
    },
    {
      "id": "cause-is-truncation",
      "level": "MUST",
      "check": "truncation_is_signalled",
      "text": "The caller can tell that the output stopped at the token limit."
    }
  ],
  "grading_notes": "Effort none keeps the 20-token limit for the tool arguments. Returning unparsed partial arguments satisfies the first requirement; the caller must also be told that the output stopped at the token limit. Repairing the arguments into a complete parsed call contradicts what the wire carried. Ollama providers are not listed because they emit whole calls or no call at the token limit, so the partial-argument requirement cannot be exercised. Gemini is not listed for the same reason: it sends whole functionCall parts, and a cut at the token limit sends MAX_TOKENS with no call part, the shape truncation.reasoning-only already covers. Anthropic uses auto and a prompt naming create_event because Sonnet 5.5 rejects forced tool choice. Its override enables eager_input_streaming on the tool: partial input_json_delta strings can end at max_tokens, and a tolerant parser may silently accept a truncated value. See https://platform.claude.com/docs/en/agents-and-tools/tool-use/fine-grained-tool-streaming. Effort none leaves adaptive thinking enabled, so the limit also covers thinking."
}
